<?xml version="1.0" encoding="UTF-8"?>
<!DOCTYPE work45 SYSTEM "work45.dtd">
<work45>
    <x1>
        <b />
    </x1>
    <x2>
        <a />
    </x2>
    <x3>
        <a />
        <b />
        <c />
    </x3>
    <x4>
        <c />
    </x4>
</work45>